{
  "schema_version": "1.0",
  "generated_date": "2026-08-30",
  "repository_head": "7a18649e96ea4e9fd1994d0a4310947f60dee64a",
  "sources": [
    {
      "id": "src-correction-report",
      "path": "deliverables_n22_24/corrections_2026_08_25/CM_BENCHMARK_AUDIT_CORRECTION_REPORT_2026-08-25.md",
      "sha256": "878336141ef1fc5a6a6fc78db7ca57cc18468076df18378bc05bb3a4a7e1c046",
      "type": "correction_report",
      "status": "current",
      "date": "2026-08-25",
      "supersedes": [],
      "superseded_by": []
    },
    {
      "id": "src-b2b4-v3-inference",
      "path": "deliverables_n22_24/corrections_2026_08_25/symmetric/audited_v3_inference.csv",
      "sha256": "63e7c80123d5487275c3b92575d9e3ca4161017f412ca7eb6e010d6b3d8b5f50",
      "type": "machine_csv",
      "status": "current",
      "date": "2026-08-25",
      "supersedes": [
        "src-b2b4-v2-summary"
      ],
      "superseded_by": []
    },
    {
      "id": "src-b2b4-v3-summary",
      "path": "deliverables_n22_24/corrections_2026_08_25/symmetric/audited_v3_summary.csv",
      "sha256": "fdc1a86ded3d6c63956e510483068b87a0fe8cdb4499c9b9a0ca10a0a307b8af",
      "type": "machine_csv",
      "status": "current",
      "date": "2026-08-25",
      "supersedes": [
        "src-b2b4-v2-summary"
      ],
      "superseded_by": []
    },
    {
      "id": "src-b2b4-v3-audit",
      "path": "deliverables_n22_24/corrections_2026_08_25/symmetric/audited_v3_audit.json",
      "sha256": "bcd59a56887b0dd80198981ae1de1921b557b56a2c87cc1a0db33a1c49941a66",
      "type": "machine_json",
      "status": "current",
      "date": "2026-08-25",
      "supersedes": [],
      "superseded_by": []
    },
    {
      "id": "src-b2b4-v2-summary",
      "path": "deliverables_n22_24/corrections_2026_08_25/symmetric/audited_v2_summary.csv",
      "sha256": "a4105294d7ae97384a2c103eeb49033c3eb7af0e153a34cc4d8b7423e828b0ad",
      "type": "machine_csv",
      "status": "superseded",
      "date": "2026-08-25",
      "supersedes": [],
      "superseded_by": [
        "src-b2b4-v3-summary"
      ]
    },
    {
      "id": "src-runpod-correction-report",
      "path": "deliverables_n22_24/correction_runpod_2026_08_25/CM_CORRECTED_RUNPOD_PASS_2026-08-25.md",
      "sha256": "ec2242a2e28069b163b5d4ab06936fd536d3a0ba6d0ed30377c9979618187d0d",
      "type": "replication_report",
      "status": "accepted",
      "date": "2026-08-25",
      "supersedes": [],
      "superseded_by": []
    },
    {
      "id": "src-runpod-pod1-raw",
      "path": "deliverables_n22_24/correction_runpod_2026_08_25/pod1_juhyi9fpkolh1g/deliverables_n22_24/pod_out/symmetric/current_raw.csv",
      "sha256": "e73eac56921459ce5f793a8a74ef71bbc94bf6737b19858191457a9a3eb0d569",
      "type": "machine_csv",
      "status": "accepted",
      "date": "2026-08-25",
      "supersedes": [],
      "superseded_by": []
    },
    {
      "id": "src-runpod-pod2-raw",
      "path": "deliverables_n22_24/correction_runpod_2026_08_25/pod2_bzpf7a9j6hmt6v/deliverables_n22_24/pod_out/symmetric/current_raw.csv",
      "sha256": "1a8a9ad9b0d0e0c4a02878c642c2f32607dabb2269d53df7f28dee50ae191bc8",
      "type": "machine_csv",
      "status": "accepted",
      "date": "2026-08-25",
      "supersedes": [],
      "superseded_by": []
    },
    {
      "id": "src-runpod-pod3-raw",
      "path": "deliverables_n22_24/correction_runpod_2026_08_25/pod3_0yki225dikil17/deliverables_n22_24/pod_out/symmetric/current_raw.csv",
      "sha256": "057edd53405a69071dd59f42b6bee0aabe98618389f4f993bd109431788ca0c2",
      "type": "machine_csv",
      "status": "accepted",
      "date": "2026-08-25",
      "supersedes": [],
      "superseded_by": []
    },
    {
      "id": "src-epfl-report",
      "path": "deliverables_n22_24/CM_GAP_EPFL_VALIDATION_2026-08-03.md",
      "sha256": "352766bd96842f971d3de0d2d4adb805d96d7527512650373f4a680d2ab30fc4",
      "type": "validation_report",
      "status": "accepted",
      "date": "2026-08-03",
      "supersedes": [],
      "superseded_by": []
    },
    {
      "id": "src-epfl-summary",
      "path": "deliverables_n22_24/CM_gap_epfl_summary_2026_08_03.csv",
      "sha256": "918c72389f36eca1487730114b32f80e9e31ff5c5aa0475ada4d1b8d2212121e",
      "type": "machine_csv",
      "status": "accepted",
      "date": "2026-08-03",
      "supersedes": [],
      "superseded_by": []
    },
    {
      "id": "src-epfl-results",
      "path": "deliverables_n22_24/cm_gap_epfl_results_2026_08_03.json",
      "sha256": "ffe3abd5e36899bb9503086c830bd36da74796b69c4cba562be3f18f45a6070f",
      "type": "machine_json",
      "status": "accepted",
      "date": "2026-08-03",
      "supersedes": [],
      "superseded_by": []
    },
    {
      "id": "src-claim-map",
      "path": "deliverables_n22_24/CM_BENCHMARK_REFRESH_CLAIM_MAP_2026-08-03.md",
      "sha256": "ee4ec55580161ff552c1d870aa22be5a581f4e7034b57d3f5b78fa5f01db7f46",
      "type": "claim_map",
      "status": "reference",
      "date": "2026-08-03",
      "supersedes": [],
      "superseded_by": [
        "src-correction-report"
      ]
    },
    {
      "id": "src-claim-addendum",
      "path": "deliverables_n22_24/CM_BENCHMARK_REFRESH_CLAIM_MAP_ADDENDUM_2026-08-03.md",
      "sha256": "fa673e4dfc503097cc3ecc81b8586a817a0fcf15c0b00b0e2da22c02d34437e4",
      "type": "claim_map",
      "status": "reference",
      "date": "2026-08-03",
      "supersedes": [],
      "superseded_by": [
        "src-correction-report"
      ]
    },
    {
      "id": "src-repo-readme",
      "path": "README.md",
      "sha256": "217d70d53873ff613ee9cdaedd3c887c69f44f6fc0f49e14c0a953815312bc87",
      "type": "documentation",
      "status": "current",
      "date": "2026-08-30",
      "supersedes": [],
      "superseded_by": []
    },
    {
      "id": "src-cm-ir",
      "path": "cm_ir.py",
      "sha256": "3e0958785ec6e34cefa2a55093c0cc8b7787a6923549d05d90b45730776bb365",
      "type": "implementation",
      "status": "current",
      "date": "2026-08-30",
      "supersedes": [],
      "superseded_by": []
    },
    {
      "id": "src-cm-build",
      "path": "cm_build.py",
      "sha256": "325987a6778feb09f2ff2e3a6a1f21e672ea1696c294f063261b2f5fbfabb33e",
      "type": "implementation",
      "status": "current",
      "date": "2026-08-30",
      "supersedes": [],
      "superseded_by": []
    },
    {
      "id": "src-bitset",
      "path": "bitset_backend.py",
      "sha256": "06a9a24a0bc1e579840d0349803353c08b86f7dd15bc7f9bad7d557d9f0c9cdf",
      "type": "implementation",
      "status": "current",
      "date": "2026-08-30",
      "supersedes": [],
      "superseded_by": []
    },
    {
      "id": "src-recognition-readme",
      "path": "docs/recognition/README.md",
      "sha256": "1f48331bccac055cbda04f9cd8a213d36da77825e6e67f146180ebe61e93825e",
      "type": "research_index",
      "status": "current",
      "date": "2026-08-30",
      "supersedes": [],
      "superseded_by": []
    },
    {
      "id": "src-recognition-roadmap",
      "path": "docs/recognition/LEARNING_ROADMAP.md",
      "sha256": "9d77116555a7cd0c2a96bbaf3c2e9b7382f67cd225942363057a1a6f00c46e31",
      "type": "research_roadmap",
      "status": "current",
      "date": "2026-08-30",
      "supersedes": [],
      "superseded_by": []
    },
    {
      "id": "src-recognition-register",
      "path": "docs/recognition/experiment_register.json",
      "sha256": "1186d3609312f2ad6184c53845debaf127dac292c224e471555c40b5cbf59b6b",
      "type": "machine_json",
      "status": "current",
      "date": "2026-08-30",
      "supersedes": [],
      "superseded_by": []
    },
    {
      "id": "src-runpod-handoff",
      "path": "docs/runpod/RUNPOD-SETUP-HANDOFF-2026-08-28.md",
      "sha256": "a2bc7c7eef5fa8794c3ee9ab86b010fc3cc5db05ff32cacdf443951e91cb2e79",
      "type": "safety_handoff",
      "status": "current",
      "date": "2026-08-28",
      "supersedes": [],
      "superseded_by": []
    }
  ]
}
